{
  "schemaVersion": 1,
  "serverModFilePatterns": [
    { "id": "programmable-hatches", "patterns": ["programmablehatches-*.jar"] },
    { "id": "ae2-things", "patterns": ["ae2thing*.jar"] },
    { "id": "twist-space-technology", "patterns": ["TwistSpaceTechnology-*.jar"] },
    { "id": "123-technology", "patterns": ["OTHTechnology-*.jar"] },
    { "id": "gt-not-leisure", "patterns": ["sciencenotleisure-*.jar", "bqapi-*.jar"] },
    { "id": "ore-excavation", "patterns": ["OreExcavation-*.jar"] },
    { "id": "iron-furnaces", "patterns": ["ironfurnaces-*.jar"] },
    { "id": "not-enough-wands", "patterns": ["notenoughwands-*.jar"] }
  ],
  "clientMods": [
    {
      "id": "extreme-sound-muffler-legacy",
      "name": "Extreme Sound Muffler: Legacy",
      "version": "1.1.1",
      "gtnh": "2.8.4",
      "artifact": {
        "name": "esm-legacy-1.7.10-1.1.1.jar",
        "url": "https://mediafilez.forgecdn.net/files/8196/169/esm-legacy-1.7.10-1.1.1.jar",
        "sha256": "065f21b2b70cc705c49beb4bc45a9ba2230481906e12a37f93727a351495a2b5",
        "sizeBytes": 399795
      }
    },
    {
      "id": "thaumcraft-research-solver",
      "name": "Thaumcraft Research Solver",
      "version": "1.0.0",
      "gtnh": "2.8.4",
      "artifact": {
        "name": "tcresearchsolver-v1.0.0.jar",
        "url": "https://github.com/egor-muindor/thaumcraft-research-solver/releases/download/v1.0.0/tcresearchsolver-v1.0.0.jar",
        "sha256": "07e606336b68a7968e98532c211ac94e0b73c312e0bebe48a3cbd5c18f610bb4",
        "sizeBytes": 189552
      }
    },
    {
      "id": "flight-inertia-toggle",
      "name": "Flight Inertia Toggle",
      "version": "1.0.0",
      "gtnh": "2.8.4",
      "artifact": {
        "name": "flightinertiatoggle-1.0.0.jar",
        "url": "https://raw.githubusercontent.com/SergeyLutsky/gtnh-server-setup/main/artifacts/flightinertiatoggle-1.0.0.jar",
        "sha256": "9ca74e704a749a01a6b5f3edd3ea4ddb9910ce8cceea3bbc21794e0368794550",
        "sizeBytes": 7739
      }
    }
  ],
  "resourcePacks": [
    {
      "id": "outlined-ores-modern",
      "name": "Outlined Ores Modern",
      "version": "e3708d6b71ba388978df55db5b481b146f6d0dbe",
      "gtnh": "2.8.4",
      "folder": "OutlinedOres-Modern",
      "archiveRoot": "OutlinedOres-Modern-e3708d6b71ba388978df55db5b481b146f6d0dbe",
      "artifact": {
        "name": "OutlinedOres-Modern-e3708d6b71ba388978df55db5b481b146f6d0dbe.zip",
        "url": "https://github.com/Ranzuu/OutlinedOres-Modern/archive/e3708d6b71ba388978df55db5b481b146f6d0dbe.zip",
        "sha256": "2d2fa396951be79dadc347598c05cd90d93091688b750ed6fe6c426beaba78e5",
        "sizeBytes": 178937
      },
      "requiredEntries": [
        "pack.mcmeta",
        "pack.png",
        "assets"
      ]
    }
  ]
}
